Title,Subtitle,Rating,Authors,Series,Volume,Publisher,Release Date,Description,ISBN-10,ISBN-13,Google ID,No. Of Pages,Dimensions,Collections,Subjects,Notes,Cover Image URL,Info URL
Managing people,a competence approach to supervisory management,,Roger Cartwright,,,Blackwell,1993-01-01,,0631190120,9780631190127,UVONQgAACAAJ,185,17.8x25.0x1.9 cm,,"Supervision of employees, Business & Economics / Human Resources & Personnel Management",,,http://books.google.com/books?id=UVONQgAACAAJ
Manufacturing industry,the impact of change,,Michael Raw,,,CollinsEducational,1993-06-17,,0003266427,9780003266429,BUVtQgAACAAJ,192,22.0x28.0 cm,,"Geography, Manufactures, Manufacturing processes",,,http://books.google.com/books?id=BUVtQgAACAAJ
Marx,a beginner's guide,,Gill Hands,,,Hodder & Stoughton,2000-01-01,"This new series from Headway offers brief yet authoritative introductions to the cultural icons of our time. Each book examines the life, the work, & the legend surrounding its subject, & key terms & concepts are highlighted & clearly explained to help consolidate the reader's understanding of the text.",0340780134,9780340780138,s5dpNwAACAAJ,96,12.8x19.8x0.7 cm,,"Marxian economics, Philosophy,, Marxist, Philosophy / Political, Political Science / Political Ideologies / Communism & Socialism, Political Science / History & Theory",,http://bks4.books.google.com/books?id=s5dpNwAACAAJ&printsec=frontcover&img=1&zoom=1&source=gbs_gdata,http://books.google.com/books?id=s5dpNwAACAAJ
Mass communication theory,an introduction,,Denis McQuail,,,Sage,1994-01-01,"The fully revised edition of this successful textbook has been comprehensively rewritten to take account of recent theory and research and to improve the accessibility of the text. The book provides a nontechnical introduction to the range of approaches to understanding mass communication. It offers an integrated treatment of the major components of mass communication - the sender, the message and the audience - and encompasses the various forms of mass communication in contemporary societies including television, radio, newspapers, film, music and new communication technologies. Throughout, Denis McQuail shows how theories of mass communication relate to the understanding of society as a whole.",0803977859,9780803977853,lBzEQgAACAAJ,416,15.6x24.0x2.5 cm,,"Mass media, Language Arts & Disciplines / Communication Studies, Social Science / Media Studies",,http://bks9.books.google.com/books?id=lBzEQgAACAAJ&printsec=frontcover&img=1&zoom=1&source=gbs_gdata,http://books.google.com/books?id=lBzEQgAACAAJ
Mastering Pascal programming,,,Eric Huggins,,,Macmillan,1983-01-01,,0333322940,9780333322949,GwphQgAACAAJ,269,14.0x23.0 cm,,"PASCAL (Computer program language), Pascal (Computer program language), Programming (Electronic computers)",,,http://books.google.com/books?id=GwphQgAACAAJ
Materials science and engineering,an introduction,,William D. Callister,,,Wiley,2000-01-01,"An outstanding book that provides complete coverage and reflects the latest developments in the field of materials science. The fifth edition maintains its extensive coverage of mechanical properties and failure and offers a new discussion of how the stress state within the body is a function of the orientation of the plane upon which the stresses are taken to act. The accompanying software is updated to include Material Properties and Cost Databases, also found in Appendix B and C of the book. An expanded feature in the software is an equation solver, E-Z Solve, which will help facilitate the solution of mathematically complex problems.",0471320137,9780471320135,XELORAAACAAJ,871,20.8x26.0x3.4 cm,,"Materials, Technology & Engineering / Engineering (General), Technology & Engineering / Material Science",,http://bks5.books.google.com/books?id=XELORAAACAAJ&printsec=frontcover&img=1&zoom=1&source=gbs_gdata,http://books.google.com/books?id=XELORAAACAAJ
MCAD/MCSE/MCDBA self-paced training kit,"Microsoft SQL Server 2000 database design and implementation, exam 70-229",,Microsoft Corporation,,,Microsoft Press,2003-06-04,"Learn how to deliver powerful database solutions using SQL Server 2000 Enterprise Editionand prepare for the Microsoft Certified Professional (MCP) examwith this official Microsoft study guide. Work at your own pace through the lessons and hands-on exercises. And use the special exam-prep section and testing tool to measure what you know and where to focus your studiesbefore taking the actual exam. As you build the real-world expertise for designing data-driven business solutions, you're also preparing for MCP Exam 70-229a core exam for MCDBA certification and a key elective on the MCSE, MCAD, and MCSD tracks.Build the skills to: Develop a logical data model Create databasesfiles, objects, space management, and growth strategy Use Transact-SQL and Data Transformation Services (DTS) to manipulate data; extract data in XML format Program business logic using stored procedures, transactions, triggers, user-defined functions, and views Optimize database performance by using SQL Profiler and the Index Tuning Wizard * Design a security plandata access, object-level security, and application rolesReady for the exam? Take practice tests on the CD.Your kit includes: Comprehensive self-paced study guide that maps to MCP exam goals and objectives NEWTest-readiness tool that generates timed, 50-question practice exams with automated scoring NEWMore than 200 pages of exam prep and objective-by-objective review Learn-by-doing exercises for skills you can apply to the job 120-day evaluation version of SQL Server 2000 Enterprise Edition Fully searchable eBook",0735619603,9780735619609,UnGuL2HSMNkC,888,19.3x23.6x4.4 cm,,"Databases/ Design/ Examinations, Databases, Electronic books, Electronic data processing personnel/ Certification, Electronic data processing personnel, Microsoft software/ Examinations/ Study guides, Microsoft software, SQL server, Computers / General, Computers / Database Management / General, Computers / Programming Languages / SQL, Computers / Certification Guides / General, Computers / Certification Guides / MCSE, Computers / Data Modeling & Design",,http://bks4.books.google.com/books?id=UnGuL2HSMNkC&printsec=frontcover&img=1&zoom=1&source=gbs_gdata,http://books.google.com/books?id=UnGuL2HSMNkC
MCTS Self-Paced Training Kit (Exam 70-536): Microsoft® .NET Framework 2.0 Application Development Foundation,,,"Tony Northrup, Shawn Wildermuth, Bill Ryan",,,Microsoft Press,2006-07-05,"Exam Prep Guide Ace your preparation for the skills measured by MCTS Exam 70-536—and on the job. Work at your own pace through a series of lessons and reviews that fully cover each exam objective. Then, reinforce what you’ve learned by applying your knowledge to real-world case scenarios and labs. This official Microsoft study guide is designed to help you make the most of your study time. Maximize your performance on the exam by learning to: Use system types, collections, and generics to help manage data Validate input, reformat text, and extract data with regular expressions Develop services, application domains, and multithreaded applications Enhance your application by adding graphics and images Implement code access security, role-based security, and data encryption Work with serialization and reflection techniques Instrument your applications with logging and tracing Interact with legacy code using COM Interop and PInvoke Practice Tests Assess your skills with practice tests on CD. You can work through hundreds of questions using multiple testing modes to meet your specific learning needs. You get detailed explanations for right and wrong answers—including a customized learning path that describes how and where to focus your studies. Your kit includes: 15% exam discount from Microsoft. Offer expires 12/31/10. Details inside. Official self-paced study guide. Practice tests with multiple, customizable testing options and a learning plan based on your results. 450 practice and review questions. Case scenarios and lab exercises. Code samples on CD. 90-day evaluation version of Microsoft Visual Studio 2005 Professional Edition. Fully searchable eBook.",0735622779,9780735622777,cT6obwAACAAJ,1088,19.1x23.5x5.4 cm,,"Application software, Electronic data processing personnel, Microsoft .NET Framework, Computers / General, Computers / Programming / General, Computers / Software Development & Engineering / General, Computers / Programming / Microsoft Programming, Computers / Certification Guides / General, Computers / Computer Engineering",,http://bks2.books.google.com/books?id=cT6obwAACAAJ&printsec=frontcover&img=1&zoom=1&source=gbs_gdata,http://books.google.com/books?id=cT6obwAACAAJ
Microsoft ADO.NET step by step,,,Rebecca Riordan,,,Microsoft Press,2002-01-30,"ADO.NET'the data-access component of the Microsoft .NET Framework'works with any component on any platform that understands XML. Get a solid handle on ADO.NET and learn how to exploit the database functionality of Microsoft Visual Basic® .NET and Microsoft Visual C#'¢ .NET with this step-by-step primer. You'll be working in ADO.NET right away with easy-to-grasp examples drawn from the real-world challenges developers face every day. Learn about the ADO.NET object model and how to use it to develop data-bound Windows® Forms and Web Forms. See how ADO.NET interacts with XML and how to access older versions of ADO from the .NET environment. Throughout, you'll find insightful tips and expert explanations for rapid acceleration of development productivity, faster applications, and more powerful results. Topics covered include: Getting started with ADO.NET Creating connections The Data command and DataReader Accessing data with the DataAdapter Working with DataSets Working with DataTables Controlling table views with DataViews Editing and updating data Data-binding in Windows Forms Data-binding in Web Forms Using the XML Designer to modify data structure Reading and writing XML with ADO.NET Using ADO from the .NET Framework CD features:* Examples of real-world solutions developed with ADO.NET, including sample code in Visual Basic .NET and Visual C# .NET",0735612366,9780735612365,mjpGAAAAYAAJ,528,18.7x23.5x3.5 cm,,"Database design, Object oriented programming (Computer science), ActiveX, Object-oriented programming (Computer science), Computers / Programming / Object Oriented, Computers / Hardware / Personal Computers / General, Computers / Database Management / General, Computers / Programming Languages / Visual BASIC, Computers / Data Modeling & Design, Computers / Desktop Applications / Spreadsheets, Computers / General, Computers / Programming / Software Development",,http://bks5.books.google.com/books?id=mjpGAAAAYAAJ&printsec=frontcover&img=1&zoom=1&source=gbs_gdata,http://books.google.com/books?id=mjpGAAAAYAAJ
Microsoft ASP.NET setup and configuration pocket reference,,,James Avery,,,Microsoft Press,2003-05-21,"Portable and precise, this pocket-sized reference is the Web application developer's fast-answers guide to ASP.NET configuration architecture, settings, and custom settings. Zero in on key ASP.NET configuration details and techniques using quick-reference tables, lists, step-by-step instructions, and real world tips, including coding examples for version 2003 of Microsoft Visual Basic .NET and Microsoft Visual C# .NET. This handy, one-stop guide delivers the focused, streamlined direction you need to get your Web solutions up and running quickly.Get fast facts to: Exploit ASP.NET configuration file inheritance Customize applications by manipulating configuration settings Configure the System.Web namespace with reference on all sections, settings, and values Use .NET configuration settings for system diagnostics, .NET Remoting, proxy settings, and just-in-time compilation Tweak ASP.NET mobile controls for the unique needs of mobile devices Configure CLR settings, including garbage collection and cryptography Use Microsoft IIS settings to manage application pools and implement Windows authentication Build and use custom sections and section handlers",0735619360,9780735619364,psS5OwAACAAJ,212,14.0x20.6x2.0 cm,,"Active server pages, Electronic books, Microsoft .NET, Web site Development/ Computer programs, Web site Development, Web site development, Computers / General, Computers / Programming / General, Computers / Programming Languages / XML, Computers / Web / General, Computers / Web / Site Design, Computers / Web / Web Programming",,http://bks9.books.google.com/books?id=psS5OwAACAAJ&printsec=frontcover&img=1&zoom=1&source=gbs_gdata,http://books.google.com/books?id=psS5OwAACAAJ
Microsoft Office Access 2003 inside out,,,John Viescas,,,Microsoft Press,2004-01-01,"Hey, you know your way around a databaseso now dig into Access 2003 and really put your information to work! This supremely organized reference packs hundreds of timesaving solutions, troubleshooting tips, and workarounds all in concise, fast-answer format. It's all muscle and no fluff. Discover the best and fastest ways to perform everyday tasks, and challenge yourself to new levels of Access mastery! Build on what you already know about Access and quickly dive into what's new Design your database the way the experts doand sidestep common mistakes Import data from spreadsheets, text files, databases, and other sources Write simple to sophisticated queries to manipulate data Learn advanced techniques for building forms and reports Develop PivotTable and PivotChart dynamic views Tap the power of Microsoft SQL Server with Access projects and views, functions, and stored procedures Implement database security features Deliver dynamic data on the Web with data access pages and XML Use Microsoft Visual Basic for Applications (VBA) and script to automate your applications and Web pagesCD features: Complete eBook in PDF format Insider Extrasincluding fully functional sample databases, VBA code, and sample web pages Catalog of Access resources with links to third-party tools and demos Microsoft resources and demos, including Insider's Guide to Microsoft Office OneNote 2003 eBook Microsoft Computer Dictionary, Fifth Edition, eBook10,000+ entries",0735615136,9780735615137,VRrplVsxIK4C,1340,18.7x24.0x5.8 cm,,"Microsoft Access, Database management, Microsoft Access 2003 (Computer programs), Visual Basic (Computer program language), Microsoft Visual BASIC, Electronic books, Computers / Programming / Software Development, Computers / Database Management / General, Computers / Desktop Applications / Databases, Computers / Desktop Applications / General, Computers / Programming / General, Computers / General",,http://bks1.books.google.com/books?id=VRrplVsxIK4C&printsec=frontcover&img=1&zoom=1&source=gbs_gdata,http://books.google.com/books?id=VRrplVsxIK4C
Microsoft Office Excel 2003 programming inside out,,,"Curtis Frye, Wayne S. Freeze, Felicia Buckingham",,,Microsoft Press,2004-03-10,"You're a sophisticated user of Excel--a real pro with spreadsheets--so now dig into its powerful programming capabilities and really put your data to work! From writing code in Microsoft Visual Basic for Applications (VBA) to taking advantage of new XML data-sharing features, this book packs hundreds of timesaving programming solutions, troubleshooting tips, and handy workarounds all in concise, fast-answer format. Discover the best and fastest ways to build custom business solutions with Excel--and challenge yourself to new levels of mastery! From automating simple tasks to building custom solutions, write better code with VBA Learn best practices for writing and debugging your own macros Use VBA code to manage dates and times, reformat worksheets, and locate external files Extend your Excel solutions by developing your own add-ins Get powerful perspectives on data by programmatically manipulating PivotTable and PivotChart dynamic views Create custom command bars, dialog boxes, and user forms Employ ActiveX Data Objects (ADO) to access external databases Exploit the new XML capabilities in Excel 2003 CD features: Complete eBook in PDF format Insider Extras--including all the authors' sample files and code Catalog of Excel resources with links to third-party tools and demos Microsoft resources and demos, including Insider's Guide to Microsoft Office OneNote 2003 eBook FREE! Microsoft Computer Dictionary, Fifth Edition, eBook--10,000+ entries A Note Regarding the CD or DVDThe print version of this book ships with a CD or DVD. For those customers purchasing one of the digital formats in which this book is available, we are pleased to offer the CD/DVD content as a free download via OReilly Medias Digital Distribution services. To download this content, please visit OReillys web site, search for the title of this book to find its catalog page, and click on the link below the cover image (Examples, Companion Content, or Practice Files). Note that while we provide as much of the media content as we are able via free download, we are sometimes limited by licensing restrictions. Please direct any questions or concerns to booktech@oreilly.com.A Note Regarding the CD or DVDThe print version of this book ships with a CD or DVD. For those customers purchasing one of the digital formats in which this book is available, we are pleased to offer the CD/DVD content as a free download via OReilly Medias Digital Distribution services. To download this content, please visit OReillys web site, search for the title of this book to find its catalog page, and click on the link below the cover image (Examples, Companion Content, or Practice Files). Note that while we provide as much of the media content as we are able via free download, we are sometimes limited by licensing restrictions. Please direct any questions or concerns to booktech@oreilly.com.",0735619859,9780735619852,_AANAAAACAAJ,594,18.7x23.5x4.0 cm,,"Business/ Computer programs, Business, Electronic books, Electronic spreadsheets, Microsoft Excel (Computer file), Computers / General, Computers / Enterprise Applications / General, Computers / Programming / General, Computers / Desktop Applications / Spreadsheets",,http://bks3.books.google.com/books?id=_AANAAAACAAJ&printsec=frontcover&img=1&zoom=1&source=gbs_gdata,http://books.google.com/books?id=_AANAAAACAAJ
Microsoft Office specialist study guide,Office 2003 edition,,,,,Microsoft Press,2004-07-21,"Demonstrate your expertise with Microsoft Office! Designed to help you practice and prepare for Microsoft Office Specialist certification, this easy-to-use study guide features: Step-by-step exercises for building and strengthening your skills Practice files on CD End-of-chapter objective reviews MeasureUp practice test to assess your exam readinessWith in-depth preparation for all the exam objectives on the Microsoft Office 2003 Editions track, including both core- and expert-level certifications, you'll gain the skills and knowledge you need to help you ace the exam!Includes one free practice test from MeasureUp! Take an online skills testlooks and scores like the certification exam Test yourself within the real application Get feedback on correct and incorrect answers Identify where you need to focus your study timeCovers all the exam objectives for: Microsoft Office Word 2003 Core Microsoft Office Word 2003 Expert Microsoft Office Excel 2003 Core Microsoft Office Excel 2003 Expert Microsoft Office PowerPoint 2003 Microsoft Office Access 2003 Microsoft Office Outlook 2003",0735621101,9780735621107,EGjvAAAAMAAJ,812,18.6x23.4x5.3 cm,,"Business/ Computer programs, Electronic data processing personnel/ Certification, Microsoft software/ Examinations/ Study guides, Microsoft Office, Business, Electronic data processing personnel, Microsoft software, Electronic books, Computers / Operating Systems / Windows Workstation, Study Aids / Professional, Computers / Enterprise Applications, Computers / General, Computers / Certification Guides / General, Computers / Desktop Applications / General",,http://bks1.books.google.com/books?id=EGjvAAAAMAAJ&printsec=frontcover&img=1&zoom=1&source=gbs_gdata,http://books.google.com/books?id=EGjvAAAAMAAJ
Microsoft Visual Basic 2005 step by step,,,Michaël Halvorson,,,Microsoft Press,2005-11-02,"Whether you are new to programming or to Visual Basic 2005, this tutorial gives you practical guidance to build your programming knowledge. Use the real-world exercises to teach yourself the essentials of Visual Basic—and begin creating applications for Microsoft Windows and the Web.Discover how to: Work in the Microsoft Visual Studio 2005 development environment Use Toolbox controls to create compelling user interfaces complete with digital photos, menus, toolbars, check boxes, and more Add artwork, animation, and special effects to an application Use inheritance and other new object-oriented programming capabilities Detect, track, and repair bugs in your code Store program data using variables, modules, arrays, and collections Add sophisticated functions to your applications with Microsoft .NET Framework 2.0 classes and methods Manage code flow with decision structures, loops, timers, and procedures Program interactive Web applications with Microsoft ASP.NET 2.0 Create datacentric applications using Microsoft ADO.NET Write custom code for printers and configure dialog boxes for printing Migrate Visual Basic 6.0 code to Visual Basic 2005 CD includes all practice exercises.A Note Regarding the CD or DVDThe print version of this book ships with a CD or DVD. For those customers purchasing one of the digital formats in which this book is available, we are pleased to offer the CD/DVD content as a free download via O'Reilly Media's Digital Distribution services. To download this content, please visit O'Reilly's web site, search for the title of this book to find its catalog page, and click on the link below the cover image (Examples, Companion Content, or Practice Files). Note that while we provide as much of the media content as we are able via free download, we are sometimes limited by licensing restrictions. Please direct any questions or concerns to booktech@oreilly.com.",0735621314,9780735621312,FxqDQgAACAAJ,523,18.4x23.0x3.6 cm,,"BASIC (Computer program language), Electronic books, Microsoft Visual BASIC, Computers / General, Computers / Programming / General, Computers / Programming Languages / Visual BASIC, Computers / Web / Web Programming",,http://bks6.books.google.com/books?id=FxqDQgAACAAJ&printsec=frontcover&img=1&zoom=1&source=gbs_gdata,http://books.google.com/books?id=FxqDQgAACAAJ
Microsoft Visual Basic .NET programming for the absolute beginner,,,Jonathan S. Harbour,,,Cengage Learning,2002-09-20,"If you are new to programming with Visual Basic .NET or upgrading from Visual Basic 6.0 and are looking for a solid introduction, this is the book for you. Developed by computer science instructors, books in the for the absolute beginner series teach the principles of programming through simple game creation. You will acquire the skills that you need formore practical Visual Basic .NET programming applications and will learn how these skills can be put to use in real world scenarios. Best of all, by the time you finish this book you will be able to apply the basic principles youve learned to the next programming language you tackle.",1592000029,9781592000029,-xhJ1yI8vFUC,450,19.0x24.0x2.4 cm,,"BASIC (Computer program language), Microsoft Visual BASIC, Visual programming languages (Computer science), Computers / Programming / General, Computers / Programming Languages / Visual BASIC",,http://bks0.books.google.com/books?id=-xhJ1yI8vFUC&printsec=frontcover&img=1&zoom=1&source=gbs_gdata,http://books.google.com/books?id=-xhJ1yI8vFUC
Mockingbird,,,Walter Tevis,,,Gollancz,2007-06-14,"The future is a grim place in which the declining human population wanders, drugged and lulled by electronic bliss. It's a world without art, reading and children, a world where people would rather burn themselves alive than endure. Even Spofforth, the most perfect machine ever created, cannot bear it and seeks only that which he cannot have - to cease to be. But there is hope for the future in the passion and joy that a man and woman discover in love and in books, hope even for Spofforth. A haunting novel, reverberating with anguish but also celebrating love and the magic of a dream.",0575079150,9780575079151,TabNAAAACAAJ,288,12.9x19.5x1.9 cm,,Fiction / General,,http://bks8.books.google.com/books?id=TabNAAAACAAJ&printsec=frontcover&img=1&zoom=1&source=gbs_gdata,http://books.google.com/books?id=TabNAAAACAAJ
Modern operating systems,,,Andrew S. Tanenbaum,,,Prentice Hall,1992-01-01,Software -- Operating Systems.,0135957524,9780135957523,FH1gQgAACAAJ,728,17.8x24.0 cm,,"Operating systems (Computers), Computers / Operating Systems / General",,http://bks9.books.google.com/books?id=FH1gQgAACAAJ&printsec=frontcover&img=1&zoom=1&source=gbs_gdata,http://books.google.com/books?id=FH1gQgAACAAJ
