Title,Subtitle,Rating,Authors,Series,Volume,Publisher,Release Date,Description,ISBN-10,ISBN-13,Google ID,No. Of Pages,Dimensions,Collections,Subjects,Notes,Cover Image URL,Info URL
Electronics for dummies,,,"Gordon McComb, Earl Boysen",,,For Dummies,2005-01-21,"Want to hook up your home theater system? Want to fix it so your garage band rocks the neighborhood? Want to solder the faulty wire on your old phonograph so you can play those 60s albums you’ve kept all this time? Whether you’re a do-it-yourselfer , hobbyist, or student , this book will turn you on to real-world electronics. It quickly covers the essentials, and then focuses on the how-to instead of theory. It covers: Fundamental concepts such as circuits, schematics, voltage, safety, and more Tools of the trade, including multimeters, oscilloscopes, logic probes, and more Common electronic components (e.g. resistors, capacitors, transistors) Making circuits using breadboards and printed circuit boards Microcontrollers (implementation and programming) Author Gordon McComb has more than a million copies of his books in print, including his bestselling Robot Builder’s Bonanza and VCRs and Camcorders For Dummies. He really connects with readers! With lots of photos and step-by-step explanations, this book will have you connecting electronic components in no time! In fact, it includes fun ideas for great projects you can build in 30 minutes or less. You’ll be amazed! Then you can tackle cool robot projects that will amaze your friends! (The book gives you lots to choose from.) Students will find this a great reference and supplement to the typical dry, dull textbook. So whether you just want to bone up on electronics or want to get things hooked up, souped up, or fixed up,…whether you’re interested in fixing old electronic equipment, understanding guitar fuzz amps, or tinkering with robots, Electronics For Dummies is your quick connection to the stuff you need to know.",0764576607,9780764576607,CvLkgK8PBJkC,434,18.8x24.0x2.3 cm,,"Electronics/ Amateurs' manuals, Electronics, Technology & Engineering / Electrical, Technology & Engineering / Electronics / General",,http://bks5.books.google.com/books?id=CvLkgK8PBJkC&printsec=frontcover&img=1&zoom=1&source=gbs_gdata,http://books.google.com/books?id=CvLkgK8PBJkC
Empire of the sun,,,James Graham Ballard,,,Harper Perennial,2006-01-01,"The heartrending story of a British boy's four year ordeal in a Japanese prison camp during the Second World War.Based on J. G. Ballard's own childhood, this is the extraordinary account of a boy's life in Japanese-occupied wartime Shanghai - a mesmerising, hypnotically compelling novel of war, of starvation and survival, of internment camps and death marches. It blends searing honesty with an almost hallucinatory vision of a world thrown utterly out of joint.Rooted as it is in the author's own disturbing experience of war in own time, it is one of a handful of novels by which the twentieth century will be not only remembered but judged.",0007221525,9780007221523,IUhVPgAACAAJ,32,12.9x19.8x2.4 cm,,"Fiction / Historical, Fiction / War & Military",,http://bks4.books.google.com/books?id=IUhVPgAACAAJ&printsec=frontcover&img=1&zoom=1&source=gbs_gdata,http://books.google.com/books?id=IUhVPgAACAAJ
Essential manager's manual,,,"Robert Heller, Tim Hindle",,,Dorling Kindersley,1998-01-01,"Learn how to convey your message confidently by improving your skills in every form of communication. Create space in your day by identifying time-wasting traps and planning your time realistically and effectively. Improve your managerial technique by discovering how to make productive, informed decisions. Free your time, establish trust and develop staff relationships by learning delegating techniques. Bring out the best in people by encouraging individual initiatives and rewarding achievement. Maximise team standards by building up an outstanding team, releasing creativity and achieving targets. Make meetings work for you by planning carefully, understanding procedures and concluding successfully. Improve your presentation skills by learning how to prepare fully, speak with confidence and handle an audience. Learn effective negotiation by discovering how to start strongly, establish common ground and close a deal. Find the best person for the job by learning to control an interview, read body language and analyse information. Discover how to adapt to new situations by anticipating and planning for change, and understanding its effects. Improve stressful ways of working by learning how to prioritise, delegate and reorganise your work. This innovative series covers a wide range of management and personal development topics. Each title is a comprehensive yet compact source of easy reference for all those in or aspiring to a position of responsibility, with a focus on developing and enhancing professional management practice.",075130400X,9780751304008,Map1QgAACAAJ,864,16.0x22.0x5.2 cm,,"Communication in management, Decision making, Management, Time management, Business & Economics / General, Business & Economics / Management, Education / Decision-Making & Problem Solving, Self-Help / Time Management",,,http://books.google.com/books?id=Map1QgAACAAJ
Europe 1890-1990,,,John Traynor,,,Nelson,1992-01-01,,0174350678,9780174350675,FoU6PgAACAAJ,365,19.0x25.0x1.8 cm,,"Europe, History / Europe / General",,http://bks8.books.google.com/books?id=FoU6PgAACAAJ&printsec=frontcover&img=1&zoom=1&source=gbs_gdata,http://books.google.com/books?id=FoU6PgAACAAJ
Excellent Dissertations!,,,Peter Levin,,,Open University Press,2005-01-01,"A must-have, expert guide for whenever you write a dissertation or extended documentProducing a dissertation is a major requirement of an increasing number of courses. The dissertation is likely to be the largest single piece of work you’ll be asked to produce. Excellent Dissertations! guides you from start to finish through the whole process: planning a dissertation project, managing it, and writing it up.",0335218229,9780335218226,i4h5QgAACAAJ,123,15.0x21.1x0.9 cm,,"Dissertations,, Academic/ Authorship/ Handbooks,, manuals,, etc, Dissertations,, Academic, Proefschriften./ gtt, Schrijfvaardigheid./ gtt, Thèses et écrits académiques, Education / Higher, Education / Students & Student Life, Language Arts & Disciplines / Composition & Creative Writing, Social Science / General",,http://bks7.books.google.com/books?id=i4h5QgAACAAJ&printsec=frontcover&img=1&zoom=1&source=gbs_gdata,http://books.google.com/books?id=i4h5QgAACAAJ
Eyewitness Nirvana,the day-by-day chronicle,,Carrie Borzillo,,,Carlton Books,2000-07-28,,1842220241,9781842220245,DQZqAAAACAAJ,192,16.1x24.0x2.5 cm,,"Rock musicians, Biography & Autobiography / Entertainment & Performing Arts, Music / Genres & Styles / Rock",,http://bks7.books.google.com/books?id=DQZqAAAACAAJ&printsec=frontcover&img=1&zoom=1&source=gbs_gdata,http://books.google.com/books?id=DQZqAAAACAAJ
French business phrase book,,,"BERLITZ PUBLISHING, Peter-Hodgson Collin",,,Berlitz,1996-02-01,"The Ideal Companion for Doing Business with FRANCE, BELGIUM, SWITZERLAND and other French-speaking countries. Over 1,400 essential phrases for all your business needs. Plus Cultural tips, and Key terms for major industries. Unique quick reference color-coded system.",2831551595,9782831551593,AnVlos3l4iEC,179,10.2x15.0x1.0 cm,,"French language/ Business French, French language/ Conversation and phrase books/ English, French language, Foreign Language Study / French",,http://bks5.books.google.com/books?id=AnVlos3l4iEC&printsec=frontcover&img=1&zoom=1&source=gbs_gdata,http://books.google.com/books?id=AnVlos3l4iEC
FrontPage 2003 all-in-one desk reference for dummies,,,John Paul Mueller,,,For Dummies,2004-10-14,"Ever looked at a great Web site and thought, “How did they do that?” Now you can do it with Front Page 2003, Microsoft’s popular Web site creation and management program. FrontPage 2003 All-in-One Desk Reference For Dummies lives up to its name! It contains nine minibooks that cover all aspects of FrontPage. Book I explains basic concepts and shows you how to create your first Web page Book II gets you started with basic Web pages and covers topics such as working with forms, tables, frames and templates Book III guides you through working with an existing Web site, creating a new Web site, using Front Page views and reports, and more Book IV gets you into advanced design features, such as using cascading Style Sheets (CSS) and clip art, adding multimedia, creating dynamic Web sites, and securing Web sites Book V covers database topics, including creating interactive Web pages with Access and developing applications with SQL Server Book VI explains how to create pages that work with XML and XSTL Book VII covers scripting techniques, such as how to perform common scripting tasks and work with cookies Book VIII covers VBA programming topics, such as storing and modifying data, creating structured programs, and trapping errors and fixing bugs Book IX offers unique coverage of advanced programming topics, such as using Front Page with Active Server Pages (ASP) and PHP, and working with Web Services (e.g., creating connections with Google, Amazon, and eBay) Written by John Paul Mueller, author of more than 63 books and 300 articles on computer topics, this book is helpful for the FrontPage newbie, who will start at the very beginning, and work at his/her own pace, and for experienced users who will forge ahead to improve and expand their skills and take advantage of all the capabilities of FrontPage 2003.",0764575317,9780764575310,7D2oRXtrI4cC,794,18.5x23.6x4.1 cm,,"Microsoft FrontPage, Web sites - Design, Web sites/ Design, Web sites, Computers / Digital Media / Desktop Publishing, Computers / Web / Page Design, Computers / Internet / Web Page Design",,http://bks4.books.google.com/books?id=7D2oRXtrI4cC&printsec=frontcover&img=1&zoom=1&source=gbs_gdata,http://books.google.com/books?id=7D2oRXtrI4cC
Generation Kill,,,Evan Wright,,,Random House,2005-04-11,"Generation Kill is about the young men sent to fight their nation's first open-ended war since Vietnam. Despite the flurry of media images to come of the recent wars in Afghanistan and Iraq, you have never really met any of these people, who serve as front-line troops. For whatever reason, the media simply doesn't get them. As we all know, news accounts of the last two wars focused almost exclusively on battlefield imagery of high-tech weapons wreaking astounding destruction, comply with analysis from retired army grandees and other experts, punctuated by the odd heart-warming patriotic sound-bite. The troops themselves play a role in the media's presentation of recent wars rather like extras in The Triumph of the Will. They are everywhere yet somehow invisible. When they speak you get the sense that what they are saying has been carefully scripted. Now Generation Kill tells the soldiers' story in their own words. The narrative focuses on a platoon of 23 marines, many of them veterans of Afghanistan, whose elite reconnaissance unit spearheaded the blitzkrieg on Iraq. This is the story of young men that have been trained to become ruthless killers. It's about surviving death. It's about taking part in a war many questioned before it even began. Evan Wright was the only reporter with First Recon, which operated well ahead of most other forces, usually behind enemy lines. They were among the first marines sent into the fight and one of the last units still engaged on the outskirts of Iraq, even after the city centre fell. Generation Kill is not just a combat chronicle but an inside look at how people fighting in war actually experience it. It is both an action narrative like Black Hawk Down and a detailed portrait of a generation at war along the lines of Band of Brothers. It is not a book you are going to forget in a hurry...",0552151890,9780552151894,juPUdF-9zM4C,465,12.8x19.8x3.0 cm,,"History / Military / United States, History / Military / Iraq War (2003-), History / Middle East / General",,http://bks6.books.google.com/books?id=juPUdF-9zM4C&printsec=frontcover&img=1&zoom=1&source=gbs_gdata,http://books.google.com/books?id=juPUdF-9zM4C
German,,,"Paul Coggle, Heiner Schenke",,,Hodder Education,2003-03-01,,0340866713,9780340866719,rOoSPwAACAAJ,368,13.0x20.0x5.2 cm,,"German language, Foreign Language Study / German",,,http://books.google.com/books?id=rOoSPwAACAAJ
German Language Course,,,Caxton Editions (Firm),,,Caxton Editions,2003-05-12,Learn the German language with authentic dialogues in modern German recorded on the CDs. Includes short exercises for practising grammar and vocabulary skills.,1840674490,9781840674491,T7mmAAAACAAJ,208,18.0x25.0x24.7 cm,,"German language, Foreign Language Study / German",,,http://books.google.com/books?id=T7mmAAAACAAJ
German-English Dictionary,,,"Geddes & Grosset,, Limited",,,"Geddes & Grosset, Limited",2000-12-31,,1855343401,9781855343405,xDF3AAAACAAJ,240,,,Foreign Language Study / German,,,http://books.google.com/books?id=xDF3AAAACAAJ
Globalization and culture,,,John Tomlinson,,,Polity,2000-01-01,,0745613381,9780745613383,-xb9tgAACAAJ,238,15.0x23.0x2.0 cm,,,,http://bks5.books.google.com/books?id=-xb9tgAACAAJ&printsec=frontcover&img=1&zoom=1&source=gbs_gdata,http://books.google.com/books?id=-xb9tgAACAAJ
Goldmine 6 for Dummies,,,Joel Scott,,,Wiley,2002-12-20,"* The fun and easy way to get the most out of GoldMine, the popular Customer Relationship Management (CRM) software * Covers the new features and enhancements to GoldMine * Discusses GoldMine essentials, such as building a contact database, tracking business activity, setting a work schedule, e-mailing and faxing, and creating reports and forecasts * Demonstrates how to customize GoldMine, distribute information to a team, and utilize remote synchronization * Author's company has been awarded GoldMine's prestigious Top 10 dealer status every year since 1996",0764508458,9780764508455,JJ9cuW6EoH8C,390,18.8x23.4x2.1 cm,,"Business - Communication systems, Business/ Communication systems, Business, GoldMine (Computer file), Sales management, Business & Economics / Customer Relations, Computers / Enterprise Applications / General, Computers / Database Management / General, Computers / Software Development & Engineering / General, Computers / Desktop Applications / Suites, Business & Economics / Sales & Selling, Computers / Enterprise Applications",,http://bks6.books.google.com/books?id=JJ9cuW6EoH8C&printsec=frontcover&img=1&zoom=1&source=gbs_gdata,http://books.google.com/books?id=JJ9cuW6EoH8C
Great Britain and the Irish question 1800-1922,,,Paul Adelman,,,Hodder & Stoughton,1996-02-05,,0340546468,9780340546468,vGOPNwAACAAJ,161,13.9x22.0x1.0 cm,,"Great Britain, Home rule, Ireland, Irish question, Political Science / International Relations / General",,,http://books.google.com/books?id=vGOPNwAACAAJ
Guitar Case Chord Book,,,"Peter Pickow, Arthur Dick",,,Music Sales,2002-01-01,Guitarskole for begyndere.,0860015513,9780860015512,IZrjAAAACAAJ,48,25.0x34.0x30.4 cm,,"Electric guitar, Guitar",,http://bks4.books.google.com/books?id=IZrjAAAACAAJ&printsec=frontcover&img=1&zoom=1&source=gbs_gdata,http://books.google.com/books?id=IZrjAAAACAAJ
Hacking,the art of exploitation,,Jon Erickson,,,No Starch Press,2008-01-01,"Hacking is the art of creative problem solving, whether that means finding an unconventional solution to a difficult problem or exploiting holes in sloppy programming. Many people call themselves hackers, but few have the strong technical foundation needed to really push the envelope. Rather than merely showing how to run existing exploits, author Jon Erickson explains how arcane hacking techniques actually work. To share the art and science of hacking in a way that is accessible to everyone, Hacking: The Art of Exploitation, 2nd Edition introduces the fundamentals of C programming from a hacker's perspective. The included LiveCD provides a complete Linux programming and debugging environment-all without modifying your current operating system. Use it to follow along with the book's examples as you fill gaps in your knowledge and explore hacking techniques on your own. Get your hands dirty debugging code, overflowing buffers, hijacking network communications, bypassing protections, exploiting cryptographic weaknesses, and perhaps even inventing new exploits. This book will teach you how to: Program computers using C, assembly language, and shell scripts Corrupt system memory to run arbitrary code using buffer overflows and format strings Inspect processor registers and system memory with a debugger to gain a real understanding of what is happening Outsmart common security measures like nonexecutable stacks and intrusion detection systems Gain access to a remote server using port-binding or connect-back shellcode, and alter a server's logging behavior to hide your presence Redirect network traffic, conceal open ports, and hijack TCP connections Crack encrypted wireless trafficusing the FMS attack, and speed up brute-force attacks using a password probability matrix Hackers are always pushing the boundaries, investigating the unknown, and evolving their art. Even if you don't already know how to program, Hacking: The Art of Exploitation, 2nd Edition will give you a complete picture of programming, machine architecture, network communications, and existing hacking techniques. Combine this knowledge with the included Linux environment, and all you need is your own creativity.",1593271441,9781593271442,0FW3DMNhl1EC,492,17.8x23.0x3.1 cm,,"Computer hackers, Computer networks - Security measures, Computer networks/ Security measures, Computer networks, Computer security, Computers / General, Computers / Networking / Security, Computers / Programming / General, Computers / Security / General",,http://bks5.books.google.com/books?id=0FW3DMNhl1EC&printsec=frontcover&img=1&zoom=1&source=gbs_gdata,http://books.google.com/books?id=0FW3DMNhl1EC
Harrap German Dictionary,,,Harrap,,,Harper,1999-07-01,,0245606289,9780245606281,d_-kPwAACAAJ,640,11.0x18.0 cm,,"English language, German language, Foreign Language Study / German",,http://bks2.books.google.com/books?id=d_-kPwAACAAJ&printsec=frontcover&img=1&zoom=1&source=gbs_gdata,http://books.google.com/books?id=d_-kPwAACAAJ
Head first Java,,,"Kathy Sierra, Bert Bates",,,"O'Reilly Media, Inc.",2005-01-01,"Learning a complex new language is no easy task especially when it s an object-oriented computer programming language like Java. You might think the problem is your brain. It seems to have a mind of its own, a mind that doesn't always want to take in the dry, technical stuff you're forced to study. The fact is your brain craves novelty. It's constantly searching, scanning, waiting for something unusual to happen. After all, that's the way it was built to help you stay alive. It takes all the routine, ordinary, dull stuff and filters it to the background so it won't interfere with your brain's real work--recording things that matter. How does your brain know what matters? It's like the creators of the Head First approach say, suppose you're out for a hike and a tiger jumps in front of you, what happens in your brain? Neurons fire. Emotions crank up. Chemicals surge. That's how your brain knows. And that's how your brain will learn Java. ""Head First Java"" combines puzzles, strong visuals, mysteries, and soul-searching interviews with famous Java objects to engage you in many different ways. It's fast, it's fun, and it's effective. And, despite its playful appearance, Head First Java is serious stuff: a complete introduction to object-oriented programming and Java. You'll learn everything from the fundamentals to advanced topics, including threads, network sockets, and distributed programming with RMI. And the new. second edition focuses on Java 5.0, the latest version of the Java language and development platform. Because Java 5.0 is a major update to the platform, with deep, code-level changes, even more careful study and implementation is required. So learning the Head First way is more important than ever. If you've read a Head First book, you know what to expect--a visually rich format designed for the way your brain works. If you haven't, you're in for a treat. You'll see why people say it's unlike any other Java book you've ever read. By exploiting how your brain works, ""Head First Java"" compresses the time it takes to learn and retain--complex information. Its unique approach not only shows you what you need to know about Java syntax, it teaches you to think like a Java programmer. If you want to be bored, buy some other book. But if you want to understand Java, this book's for you.",0596009208,9780596009205,5VTBuvfZDyoC,722,20.3x24.0x3.8 cm,,"Electronic books, Java (Computer program language), Object-oriented programming (Computer science), Computers / Programming / General, Computers / Programming Languages / General, Computers / Programming / Object Oriented, Computers / Programming Languages / Java, Computers / Certification Guides / General",,http://bks6.books.google.com/books?id=5VTBuvfZDyoC&printsec=frontcover&img=1&zoom=1&source=gbs_gdata,http://books.google.com/books?id=5VTBuvfZDyoC
How to write dissertations & project reports,,,"Kathleen McMillan, Jonathan Weyers",,,Pearson Further Education,2009-05-11,"How to write great dissertations and projects provides all of the tips and techniques that a student is likely to need to choose, research, write and present dissertations and projects that will guarantee you top marks.",0273726935,9780273726937,x_5JPgAACAAJ,286,13.3x21.0x1.3 cm,,"Dissertations,, Academic/ Authorship, Dissertations,, Academic, Report writing, Business & Economics / Business Communication / General, Education / Higher, Language Arts & Disciplines / Composition & Creative Writing, Reference / Writing Skills",,http://bks0.books.google.com/books?id=x_5JPgAACAAJ&printsec=frontcover&img=1&zoom=1&source=gbs_gdata,http://books.google.com/books?id=x_5JPgAACAAJ
HTML 4 for dummies quick reference,,,"Deborah S. Ray, Eric J. Ray",,,Wiley,2000-07-18,"No one can memorize the hundreds of HTML tags that make up the 4.01 standard. HTML 4 For Dummies Quick Reference, 2nd Edition provides a guide to all the updated HTML tags as well as easy-to-follow information on building HTML Web pages and sites and posting your work online. Unique to this Quick Reference is a full-color Cheat Sheet that displays 216 colors available for use on a Web page with HTML.",0764507214,9780764507212,qQ9wAAAACAAJ,240,15.2x21.6x1.8 cm,,"Electronic publishing, HTML (Document markup language), Hypertext systems, Web sites/ Design, Web sites, World Wide Web, Computers / Networking / General, Computers / Programming Languages / HTML, Computers / Internet / General, Computers / Web / Page Design",,http://bks4.books.google.com/books?id=qQ9wAAAACAAJ&printsec=frontcover&img=1&zoom=1&source=gbs_gdata,http://books.google.com/books?id=qQ9wAAAACAAJ
I. B. M. Personal Computer Assembly Language and Programming,,,Peter Abel,,,Pearson plc,1994-12-31,,0131920634,9780131920637,XzPzQwAACAAJ,560,18.0x24.0 cm,,,,,http://books.google.com/books?id=XzPzQwAACAAJ
Information technology for travel and tourism,,,Gary Inkpen,,,Pitman,1994-01-01,,0273602292,9780273602293,zrFxQgAACAAJ,294,19.0x25.0x1.9 cm,,"Data processing, Information technology, Tourism, Tourist trade, Travel, Business & Economics / Industries / Hospitality,, Travel & Tourism, Computers / General",,http://bks2.books.google.com/books?id=zrFxQgAACAAJ&printsec=frontcover&img=1&zoom=1&source=gbs_gdata,http://books.google.com/books?id=zrFxQgAACAAJ
Instant Russian,,,Elisabeth Smith,,,Hodder Education,2003-06-01,,0340866845,9780340866849,VbDqGwAACAAJ,116,13.0x20.0x23.1 cm,,Foreign Language Study / Russian,,,http://books.google.com/books?id=VbDqGwAACAAJ
Introducing Systems Development,,,"Steve Skidmore, Malcolm Eva",,,Palgrave Macmillan,2003-08-20,,0333973690,9780333973691,7qtQGwAACAAJ,352,19.0x25.0x2.4 cm,,"System design, Computers / Computer Science, Computers / Software Development & Engineering / Systems Analysis & Design",,http://bks4.books.google.com/books?id=7qtQGwAACAAJ&printsec=frontcover&img=1&zoom=1&source=gbs_gdata,http://books.google.com/books?id=7qtQGwAACAAJ
Introduction to engineering mathematics,,,"Tony Croft, Anthony Croft, Robert Davison, Martin Hargreaves",,,Addison-Wesley,1995-01-01,"This text provides a well-paced, mathematically sound and motivating foundation in 'applicable' mathematics. The book aims to give students the ability to think conceptually in mathematical terms by presenting mathematical techniques, together with simple and clear explanations of the concepts behind them. A wide variety of practical engineering examples are used to reinforce the mathematics.",0201624427,9780201624427,C5djQgAACAAJ,762,17.2x24.0x4.0 cm,,"Engineering mathematics, Mathematics / General, Technology & Engineering / Engineering (General)",,http://bks1.books.google.com/books?id=C5djQgAACAAJ&printsec=frontcover&img=1&zoom=1&source=gbs_gdata,http://books.google.com/books?id=C5djQgAACAAJ
"Italy: liberalism and Fascism, 1870-1945",,,Mark Robson,,,Hodder & Stoughton,1995-01-01,,0340545488,9780340545485,CM9StwAACAAJ,154,,,,,,http://books.google.com/books?id=CM9StwAACAAJ
