Title,Subtitle,Rating,Authors,Series,Volume,Publisher,Release Date,Description,ISBN-10,ISBN-13,Google ID,No. Of Pages,Dimensions,Collections,Subjects,Notes,Cover Image URL,Info URL
Programming Microsoft Robotics Studio,,,Sara Morgan,,,Microsoft Press,2008-03-12,"Get the practical reference to programming robotic applications using the Microsoft Robotics Studio. Ideal for programmers familiar with Windowsbased development using Microsoft Visual Studio and the Microsoft .NET Framework, this guide shows how to use the services provided in the Robotics Studio to handle navigation and remote control, speech, video, and intelligent behavior in a robotic device. It covers the Visual Programming Language included in Robotics Studio, and offers illuminating code examples in Microsoft Visual C#.",0735624321,9780735624320,8ls4GgAACAAJ,253,18.6x22.9x2.2 cm,,"Electronic books, Microsoft Robotics studio, Microsoft software, Robotics, Robots - Control systems - Computer simulation, Robots - Programming, Robots/ Control systems/ Computer simulation, Robots/ Programming, Robots, Computers / General, Computers / Intelligence (AI) & Semantics, Computers / Hardware / Peripherals, Computers / Programming / General, Computers / Software Development & Engineering / General, Computers / Desktop Applications / General, Technology & Engineering / Robotics",,http://bks4.books.google.com/books?id=8ls4GgAACAAJ&printsec=frontcover&img=1&zoom=1&source=gbs_gdata,http://books.google.com/books?id=8ls4GgAACAAJ
Programming with ANSI C,,,B J Holmes,,,DP Publications,1995-01-01,,1858051177,9781858051178,x_DmAAAACAAJ,512,19.0x25.0 cm,,"C (Computer program language), Programming languages, Computers / Programming / General, Computers / Programming Languages / General, Computers / Programming Languages / C",,http://bks6.books.google.com/books?id=x_DmAAAACAAJ&printsec=frontcover&img=1&zoom=1&source=gbs_gdata,http://books.google.com/books?id=x_DmAAAACAAJ
Project Management for Information Systems,,,"James Cadle, Donald Yeates",,,Pearson Education,2008-01-01,This edition addresses the issue of organisational culture in more detail and it gives an analysis of why information system projects fail and what can be done to make success more likely.,0132068583,9780132068581,bYxBl3TM9RkC,468,18.7x24.6x2.6 cm,,"Information resources management, Management information systems, Project management, Business & Economics / General, Business & Economics / Information Management, Business & Economics / Project Management, Computers / Management Information Systems, Computers / Software Development & Engineering / Systems Analysis & Design, Science / System Theory",,http://bks8.books.google.com/books?id=bYxBl3TM9RkC&printsec=frontcover&img=1&zoom=1&source=gbs_gdata,http://books.google.com/books?id=bYxBl3TM9RkC
Prolog programming for artificial intelligence,,,Ivan Bratko,,,Addison-Wesley Pub. Co.,1990-01-01,New information in the field of Artificial Intelligence prompted the revision of this bestselling Prolog title that includes many examples and programming exercises.,0201416069,9780201416060,zm99QgAACAAJ,597,17.2x24.0x1.2 cm,,"Artificial intelligence - Data processing, Artificial intelligence, Prolog (Computer language), Prolog (Computer program language), Computers / Intelligence (AI) & Semantics, Computers / Programming Languages / Prolog",,http://bks6.books.google.com/books?id=zm99QgAACAAJ&printsec=frontcover&img=1&zoom=1&source=gbs_gdata,http://books.google.com/books?id=zm99QgAACAAJ
Pure mathematics,,,"Geoff Mannall, Michael Kenwood",,,Heinemann,2001-07-10,Heinemann Modular Mathematics for Edexcel AS and A Level provides dedciated textbooks to help give your students a clear route to success. Revision books also available.,0435510924,9780435510923,lIONPwAACAAJ,147,19.5x27.0x1.2 cm,,"A-level examinations, Mathematics, Juvenile Nonfiction / Mathematics / General",,http://bks8.books.google.com/books?id=lIONPwAACAAJ&printsec=frontcover&img=1&zoom=1&source=gbs_gdata,http://books.google.com/books?id=lIONPwAACAAJ
Pure maths,,,"Sam Boardman, Tony Clough, David Evans",,,Heinemann,2002-10-17,Advancing Maths for AQA provides exceptional preparation for the new AQA specification B.,0435513036,9780435513030,m_0uDXl3UJ0C,228,19.6x27.0x1.4 cm,,"A-level examinations, Advanced supplementary examinations, Mathematics, Mathematics / Study & Teaching, Mathematics / General",,http://bks3.books.google.com/books?id=m_0uDXl3UJ0C&printsec=frontcover&img=1&zoom=1&source=gbs_gdata,http://books.google.com/books?id=m_0uDXl3UJ0C
QBasic programming for dummies,,,Douglas Hergert,,,"IDG Books Worldwide, Inc.",1994-01-01,"A fast and friendly reference to QBasic, the most popular language for novices learning to program, QBasic for Dummies leads readers, in a sequence of easy exercises, through all the beginning steps--how to start QBasic, type the lines of a program, correct mistakes in the code, and get your own homemade computer program up and running.",1568840934,9781568840932,H0cHAAAACAAJ,399,25.1x24.0x2.5 cm,,"QBasic (Computer program language), Computers / Programming / General, Computers / Programming Languages / General, Computers / Programming Languages / BASIC",,http://bks8.books.google.com/books?id=H0cHAAAACAAJ&printsec=frontcover&img=1&zoom=1&source=gbs_gdata,http://books.google.com/books?id=H0cHAAAACAAJ
Quantitative methods for business decisions,,,"Jon Curwin, Roger Slater",,,International Thomson Business Press,1996-01-01,"This new edition contains clear and readable explanations of the statistical and mathematical methods most commonly taught in quantitative courses. Microstats, a public domain software package, is provided in a 3.5 floppy disk included in the book. This provides an easy-to-use software tool and contains data sets from the cases and exercises downloaded in Excel and Lotus 123. Clear explanations for the use of Minitab, SPSS, Lotus 123 and Excel are provided within each chapter and topic.",1861520271,9781861520272,QIBFAAAAYAAJ,692,24.4x25.0x4.4 cm,,"Statistics, Business mathematics, Decision making, Business & Economics / Management Science, Business & Economics / Decision-Making & Problem Solving, Business & Economics / Management, Business & Economics / Statistics, Business & Economics / Business Mathematics, Education / Decision-Making & Problem Solving, Mathematics / Probability & Statistics / General",,http://bks5.books.google.com/books?id=QIBFAAAAYAAJ&printsec=frontcover&img=1&zoom=1&source=gbs_gdata,http://books.google.com/books?id=QIBFAAAAYAAJ
Religion,,,Ian Thompson,,,Longman,1986-01-01,"Identifies the themes, issues, and trends of religion and discusses the relationship between sociology and religion.",0582354978,9780582354975,PMsnAAAAYAAJ,120,,,"Religion and sociology, Religion, Social Science / General, Religion / General, Social Science / Sociology of Religion, Religion / Comparative Religion",,http://bks2.books.google.com/books?id=PMsnAAAAYAAJ&printsec=frontcover&img=1&zoom=1&source=gbs_gdata,http://books.google.com/books?id=PMsnAAAAYAAJ
Research methodology,a step-by-step guide for beginners,,Ranjit Kumar,,,SAGE,2005-01-01,"As with the first, the Second Edition of Research Methodology is designed specifically for students with no previous experience or knowledge of research and research methodology.New to this edition: - the paradigms of research have been expanded to present a way of thinking that helps students gain a clear idea of the different examples used in research;- material on focus groups, development of conceptual framework for unstructured interviews and greater detail on in-depth interviewing has been expanded, allowing students to discuss and analyse the differing methods of data collection;Â - new material on analyzing quantitative data and separate sections for the analysis of qualitative and quantitative research. This gives a comprehensive and concise discussion of the two major research types; - the chapter on Research Methodology and Practice Evaluation contains 11 new figures and one new table for enhanced visual learning and analysis. This clear and concise text links theory with eight practical steps central to any research process. It focuses on developing research skills by providing practical examples from both qualitative and quantitative research for a balanced and comprehensive grounding in research methodology.",141291194X,9781412911948,x_kp__WmFzoC,352,18.2x25.0x1.9 cm,,"Research, Social sciences - Research - Methodology, Social sciences/ Research/ Methodology, Social sciences, Reference / Research, Science / Research & Methodology, Social Science / Methodology, Social Science / Research",,http://bks4.books.google.com/books?id=x_kp__WmFzoC&printsec=frontcover&img=1&zoom=1&source=gbs_gdata,http://books.google.com/books?id=x_kp__WmFzoC
RESTful web services,,,"Leonard Richardson, Sam Ruby",,,"O'Reilly Media, Inc.",2007-01-01,"""Every developer working with the Web needs to read this book."" -- David Heinemeier Hansson, creator of the Rails framework ""RESTful Web Services finally provides a practical roadmap for constructing services that embrace the Web, instead of trying to route around it."" -- Adam Trachtenberg, PHP author and EBay Web Services Evangelist You've built web sites that can be used by humans. But can you also build web sites that are usable by machines? That's where the future lies, and that's what RESTful Web Servicesshows you how to do. The World Wide Web is the most popular distributed application in history, and Web services and mashups have turned it into a powerful distributed computing platform. But today's web service technologies have lost sight of the simplicity that made the Web successful. They don't work like the Web, and they're missing out on its advantages. This book puts the ""Web"" back into web services. It shows how you can connect to the programmable web with the technologies you already use every day. The key is REST, the architectural style that drives the Web. This book: Emphasizes the power of basic Web technologies -- the HTTP application protocol, the URI naming standard, and the XML markup language Introduces the Resource-Oriented Architecture (ROA), a common-sense set of rules for designing RESTful web services Shows how a RESTful design is simpler, more versatile, and more scalable than a design based on Remote Procedure Calls (RPC) Includes real-world examples of RESTful web services, like Amazon's Simple Storage Service and the Atom Publishing Protocol Discusses web service clients for popular programming languages Shows how to implement RESTful services in three popular frameworks -- Ruby on Rails, Restlet (for Java), and Django (for Python) Focuses on practical issues: how to design and implement RESTful web services and clients This is the first book that applies the REST design philosophy to real web services. It sets down the best practices you need to make your design a success, and the techniques you need to turn your design into working code. You can harness the power of the Web for programmable applications: you just have to work with the Web instead of against it. This book shows you how.",0596529260,9780596529260,XUaErakHsoAC,448,17.8x23.3x2.7 cm,,"Electronic books, Web services, Web site development, Computers / General, Computers / Systems Architecture / General, Computers / Computer Science, Computers / Information Technology, Computers / Software Development & Engineering / Systems Analysis & Design, Computers / Computer Engineering, Computers / Web / General, Computers / Electronic Commerce, Computers / Internet / Web Page Design",,http://bks5.books.google.com/books?id=XUaErakHsoAC&printsec=frontcover&img=1&zoom=1&source=gbs_gdata,http://books.google.com/books?id=XUaErakHsoAC
RIPLEY'S - BELIEVE IT OR NOT 2009!,PREPARE TO BE SHOCKED!,,R. L. Ripley,,,Random House,2008-10-02,"Following hot on the heels of last year's best-selling edition, Ripley's Believe it or Not 2009 offers a whole new feast of bizarre facts, fiends and freaks ndash; all guaranteed to fascinate, surprise and amaze. Stare in wonder at the man who swallowed a solid steel sword underwater; gasp at the pelican who ate a pigeon; and marvel at the man who swam down the Amazon, dodging piranhas, pirates and whirlpools. Illustrated throughout with extraordinary colour photographs, this fascinating book is a must-have for anyone intrigued by the stranger aspects of our planet and its inhabitants.",1847945120,9781847945129,2SxcGQAACAAJ,256,23.3x30.4x2.3 cm,,"Humor / General, Reference / Curiosities & Wonders",,http://bks1.books.google.com/books?id=2SxcGQAACAAJ&printsec=frontcover&img=1&zoom=1&source=gbs_gdata,http://books.google.com/books?id=2SxcGQAACAAJ
Sams teach yourself C++ in 24 hours,,,"Jesse Liberty, David B. Horvath",,,Sams,2005-01-01,"Unbeatable formula for learning C++: Easy-to-understand chapters, well-crafted examples, and a C++ compiler to test the examples.",0672326817,9780672326813,JgXpQwAACAAJ,503,18.6x24.0x2.8 cm,,"C++ (Computer program language), Computers / Programming Languages / C",,http://bks0.books.google.com/books?id=JgXpQwAACAAJ&printsec=frontcover&img=1&zoom=1&source=gbs_gdata,http://books.google.com/books?id=JgXpQwAACAAJ
Sams teach yourself Java 6 in 21 days,,,"Rogers Cadenhead, Laura Lemay",,,Sams,2007-06-04,";If you get only one Java book, it should be Sams Teach Yourself Java in 21 Days ; ;PC Magazine In just 21 days, you can acquire the knowledge and skills necessary to develop three kinds of programs with Java: applications on your computer, servlets on a web server, and browser-launched Java Web Start applications. No previous programming experience required. By following the 21 carefully organized lessons in this book, anyone can learn the basics of Java programming. Learn at your own pace. You can work through each chapter sequentially to make sure you thoroughly understand all of the concepts and methodologies, or you can focus on specific lessons to learn the techniques that interest you most. Test your knowledge. Each chapter ends with a Workshop section filled with questions, answers, and exercises for further study. There are even certification practice questions. ;Sams Teach Yourself Java is one of the best introductions to hands-on Java programming. If you buy one book on Java, this is the one to buy! ; ;Independent Web Review Completely revised, updated, and expanded to cover the latest features of Java 6 Learn to develop standalone Java applications, web servlets, JavaServer Pages, and Java Web Start applications Easy-to-understand, practical examples clearly illustrate the fundamentals of Java programming Discover how Swing can help you quickly develop programs with a graphical user interface Find out about JDBC database programming, Internet client/server programming, and XML parsing with the open source XOM class library Covers new features of version 6 such as Java DB, the new relational database that is now a built-in part of Java Rogers Cadenhead is a web application developer who has written 22 books on Internet-related topics, including Sams Teach Yourself Java 2 in 24 Hours. He maintains this book's official website at http://www.java21days.com. Laura Lemay is one of the world's most popular authors on Web development topics. She is the author of the bestselling Sams Teach Yourself Web Publishing with HTML, as well as Sams Teach Yourself Perl in 21 Days. CD-ROM includes: Source code for the examples developed in the book Java"" SE Development Kit 6 NetBeans"" IDE 5.5 Bonus materials Category: Java Programming Covers: Java 6 Platform Standard Edition User Level: Beginning-Intermediate $44.99 USA / $55.99 CAN / £31.99 Net UK (inc. of VAT)",0672329433,9780672329432,9OD3QAAACAAJ,697,17.8x23.1x4.2 cm,,"Electronic books, Java (Computer program language), Computers / General, Computers / Programming Languages / Java",,http://bks3.books.google.com/books?id=9OD3QAAACAAJ&printsec=frontcover&img=1&zoom=1&source=gbs_gdata,http://books.google.com/books?id=9OD3QAAACAAJ
Sams teach yourself Linux in 24 hours,,,Bill Ball,,,Sams,1999-06-16,"Sams Teach Yourself Linux in 24 Hours, Second Edition is a tutorial aimed at making the Linux beginner more effective and productive users of the operating system.",0672315262,9780672315268,fnu8QgAACAAJ,574,18.9x24.0x3.7 cm,,"Linux, Operating systems (Computers), Operating systems (computers), Operating systems, Computers / Operating Systems / UNIX, Computers / Operating Systems / Windows Workstation, Computers / Operating Systems / Linux",,http://bks5.books.google.com/books?id=fnu8QgAACAAJ&printsec=frontcover&img=1&zoom=1&source=gbs_gdata,http://books.google.com/books?id=fnu8QgAACAAJ
Sams teach yourself Microsoft SQL Server 2005 Express in 24 hours,,,Alison Balter,,,New Riders,2006-06-26,"Written with clarity and a down-to-earth approach,Sams Teach Yourself SQL Server 2005 Express in 24 Hourscovers the basics of Microsoft's latest version of SQL Server. Expert authorAlison Baltertakes you from basic concepts to an intermediate level in 24 one-hour lessons. You will learn all of the basic tasks necessary for the administration of SQL Server 2005. You will also learn how to write and fully utilize: SQL Server stored procedures Functions Triggers using T-SQL, VB.NET, and C# You will also learn how to output SQL Server data to reports and the Internet.Sams Teach Yourself SQL Server 2005 Express in 24 Hoursis a well-organized, authoritative introduction that will quickly have you up and running with SQL Server 2005.",0672327414,9780672327414,VoDSMXfimcYC,458,17.8x23.2x2.7 cm,,"Client/server computing, Database management, Electronic books, Relational databases, SQL server, Computers / Database Management / General",,http://bks6.books.google.com/books?id=VoDSMXfimcYC&printsec=frontcover&img=1&zoom=1&source=gbs_gdata,http://books.google.com/books?id=VoDSMXfimcYC
Sams Teach Yourself Microsoft SQL Server T-SQL in 10 Minutes,,,Ben Forta,,,Sams,2007-08-12,"Sams Teach Yourself Microsoft SQL Server T-SQL in 10 Minutesoffers straightforward, practical answers when you need fast results. By working through 10-minute lessons, you'll learn everything you need to know to take advantage of Microsoft SQL Server's T-SQL language. This handy pocket guide starts with simple data retrieval and moves on to more complex topics, including the use of joins, subqueries, full text-based searches, functions and stored procedures, cursors, triggers, table constraints, XML, and much more. You'll learn what you need to know methodically, systematically, and simply–in highly focused lessons designed to make you immediately and effortlessly productive. Tips point out shortcuts and solutions Cautions help you avoid common pitfalls Notes explain additional concepts, and provide additional information 10 minutes is all you need to learn how to& Use T-SQL in the Microsoft SQL Server environment Construct complex T-SQL statements using multiple clauses and operators Filter data so you get the information you need quickly Retrieve, sort, and format database contents Join two or more related tables Make SQL Server work for you with globalization and localization Create subqueries to pinpoint your data Automate your workload with triggers Create and alter database tables Work with views, stored procedures, and more Register your book at www.samspublishing.com/register to download examples and source code from this book.",0672328674,9780672328671,1gJAEDNA1fYC,449,13.8x21.0x2.0 cm,,"Client/server computing, Database management, Electronic books, Relational databases, SQL (Computer program language), SQL server, Computers / Database Management / General, Computers / Programming Languages / SQL",,http://bks6.books.google.com/books?id=1gJAEDNA1fYC&printsec=frontcover&img=1&zoom=1&source=gbs_gdata,http://books.google.com/books?id=1gJAEDNA1fYC
Sams teach yourself SQL in 10 minutes,,,Ben Forta,,,Sams Publishing,2004-04-10,"""Sams Teach Yourself SQL in 10 Minutes"" has established itself as the gold standard for introductory SQL books, offering a fast-paced accessible tutorial to the major themes and techniques involved in applying the SQL language. Forta's examples are clear and his writing style is crisp and concise. As with earlier editions, this revision includes coverage of current versions of all major commercial SQL platforms. New this time around is coverage of MySQL, and PostgreSQL. All examples have been tested against each SQL platform, with incompatibilities or platform distinctives called out and explained.",0672325675,9780672325670,RGE08zEHRwcC,260,15.7x21.0x1.6 cm,,"Database management, Electronic books, SQL (Computer program language), Computers / Database Management / General, Computers / Programming Languages / SQL, Computers / Desktop Applications / Databases",,http://bks6.books.google.com/books?id=RGE08zEHRwcC&printsec=frontcover&img=1&zoom=1&source=gbs_gdata,http://books.google.com/books?id=RGE08zEHRwcC
Simply Visual Basic .NET,,,"Harvey M. Deitel, Paul J. Deitel, Tem R. Nieto",,,Prentice Hall,2003-04-09,"-- Features the Deitels brand new Application-Driven ""TM"" approach.-- Features 3 case studies covering introductions to computer graphics, multimedia and building a 3-tier, Web-based application that interacts with a database.-- Full-color text, code highlighting, syntax coloring, code line numbering and more!This first book in the new Simply Series is a complete, step-by-step tutorial introduction to the fundamentals of Visual Basic .NET programming. Simply Visual Basic. NET combines the Deitel signature Live-Code ""TM"" approach with a new Application-Driven ""TM"" methodology in which readers learn concepts and incorporate programming fundamentals into applications that they build and interact with from the ground up. Learn control structures, data types, arrays, object-oriented programming, exception handling, GUI design, strings, sequential files, random access files and more using the Deitel Live-Code ""TM"" and Application-driven ""TM"" approaches. This comprehensive introduction to Visual Basic .NET also includes an overview section of higher-end topics and three optional case studies that allow students to learn database programming, multimedia and graphics. The Simply Series features full-color text, code highlighting, syntax coloring, code line numbering plus a glossary of key terms, exercises (about half with answers), terminology sections, multi-level index and colorized-UML diagrams (instead of flowcharts).",0131405535,9780131405530,jn2SQgAACAAJ,826,21.6x28.0x3.0 cm,,"BASIC (Computer program language), Microsoft .NET, Microsoft Visual BASIC, Computers / Programming / General, Computers / Programming Languages / Visual BASIC, Computers / Programming Languages / VBScript",,http://bks3.books.google.com/books?id=jn2SQgAACAAJ&printsec=frontcover&img=1&zoom=1&source=gbs_gdata,http://books.google.com/books?id=jn2SQgAACAAJ
Smart things to know about marketing,,,John L. Mariotti,,,John Wiley & Sons,2001-03-15,The five smartest things to know about marketing at the speed of light in the new economy.,1841120952,9781841120959,WKH8huq7oXEC,372,17.4x20.9x2.7 cm,,"Industrial marketing, Marketing, Smart structures, Business & Economics / Advertising & Promotion, Business & Economics / Marketing / General",,http://bks1.books.google.com/books?id=WKH8huq7oXEC&printsec=frontcover&img=1&zoom=1&source=gbs_gdata,http://books.google.com/books?id=WKH8huq7oXEC
Step by step karate skills,,,Dan Bradley,,,Hamlyn,1987-09-18,,060050350X,9780600503507,UY3wGwAACAAJ,127,,,"Karate, Sports & Recreation / Martial Arts & Self-Defense",,,http://books.google.com/books?id=UY3wGwAACAAJ
Stereophonics -- Performance and Cocktails,Guitar TAB Edition,,Stereophonics,,,"Alfred Publishing Co., Inc.",1999-04-19,"Titles are: Roll Up and Shine * The Bartender and the Thief * Hurry Up and Wait * Pick a Part That's New * Just Looking * Half the Lies You Tell Ain't True * I Wouldn't Believe Your Radio * T-Shirt Suntan * Is Yesterday, Tomorrow, Today? * A Minute Longer * She Takes Her Clothes Off * Plastic California * I Stopped to Fill My Car Up.",0711973199,9780711973190,4Jp4RAAACAAJ,,22.4x31.0x30.2 cm,,"Rock music, Music / Musical Instruments / Guitar, Music / Printed Music / General",,http://bks8.books.google.com/books?id=4Jp4RAAACAAJ&printsec=frontcover&img=1&zoom=1&source=gbs_gdata,http://books.google.com/books?id=4Jp4RAAACAAJ
Stick Fighting,Techniques of Self-Defense,,"Masaaki Hatsumi, Quintin Chambers",,,Kodansha International,1981-09-15,"Step-by-step instructions and over 300 photographs allow the trainee to follow and learn the techniques with ease. The ideal weapon for self-defense is a stick. To find a comprehensive system of techniques using the stick, we must turn to the East, for systems known to the West have fallen into disuse. In this book, the techniques of Kukishin Ryu-an ancient Japanese method-have been updated and adapted for use today. A thorough grounding in the fundamentals dealt with here will enable you to disarm and control any assailant. CONTENTS Section 1: Basic Movements Section 2: Techniques against First Attack Section 3: Techniques against Foot Attacks Section 4: Techniques against Wrist Holding Section 5: Techniques against Sleeve and Lapel Holding Section 6: Techniques against Seizure from Behind Section 7: Techniques against Stick Holding Section 8: Immobilizations",0870114751,9780870114755,0tHG6ryRJeUC,156,20.8x14.7x1.3 cm,,"Stick fighting, Sports & Recreation / Martial Arts & Self-Defense",,http://bks3.books.google.com/books?id=0tHG6ryRJeUC&printsec=frontcover&img=1&zoom=1&source=gbs_gdata,http://books.google.com/books?id=0tHG6ryRJeUC
