Title,Subtitle,Rating,Authors,Series,Volume,Publisher,Release Date,Description,ISBN-10,ISBN-13,Google ID,No. Of Pages,Dimensions,Collections,Subjects,Notes,Cover Image URL,Info URL
100 Irish Ballads Vol2 MLC,,,Music Sales Limited,,,Music Sales Limited,,,1857200691,9781857200690,lchUAAAACAAJ,,,,,,,http://books.google.com/books?id=lchUAAAACAAJ
A crown of swords,,,Robert Jordan,,,Orbit,1997-03-20,"Elayne, Aviendha and Mat come ever closer to the bowl ter'angreal that may reverse the world's endless heatwave and restore natural weather. Egwene begins to gather all manner of women who can channel - Sea Folk, Windfinders, Wise Ones, and some surprising others. And, above all, Rand faces the dread Forsaken Sammael, in the shadows of Shadar Logoth, where the blood-hungry mist, Mashadar, waits for prey . . .",1857234030,9781857234039,_rSqQgAACAAJ,762,10.8x18.0x4.9 cm,,"Fantasy fiction, Rand al'Thor (Fictitious character), Fiction / Fantasy / Epic",,,http://books.google.com/books?id=_rSqQgAACAAJ
Absolute beginner's guide to C,,,Greg M. Perry,,,Sams Pub.,1994-01-01,"For beginning programmers, this updated edition answers all C programming questions. This bestseller talks to readers at their level, explaining every aspect of how to get started and learn the C language quickly. Readers also find out where to learn more about C. This book includes tear-out reference card of C functions and statements, a hierarchy chart, and other valuable information. It uses special icons, notes, clues, warnings, and rewards to make understanding easier. And the clear and friendly style presumes no programming knowledge.",0672305100,9780672305108,dFSrq0PJGCUC,434,19.0x24.0x2.2 cm,,"C (Computer program language), Computers / Programming Languages / C",,http://bks3.books.google.com/books?id=dFSrq0PJGCUC&printsec=frontcover&img=1&zoom=1&source=gbs_gdata,http://books.google.com/books?id=dFSrq0PJGCUC
Access 2003 all-in-one desk reference for dummies,,,"Alan Simpson, Margaret Levine Young, Alison Barrows",,,Wiley Pub.,2003-01-01,"Many people call our current era ""The Age of Information."" True, the body of information is increasing at an unprecedented pace, and information is more accessible than ever. But information doesn’t mean diddly-squat if you don’t know how to use it. Access 2003 All-In-One Desk Reference for Dummies is your one-stop guide to building databases and managing information with Access 2003, covering the basics like tables, queries, forms, and reports and more advanced functions such as using Visual Basic for Applications (VBA) and writing code. If you want, you can go all the way to geekdom, or you can simply find out how to make the most of your data to better manage your business by: Creating and modifying tables and entering and editing data Sorting, finding, and filtering data Creating queries, including update queries, action queries, and the Query Wizards Building forms with AutoForm and Wizards Creating charts and graphs from your data Maintaining, sharing, and securing your Access database Letting Access do the math, whether it’s calculating simple cost per unit or performing complex financial functions Microsoft Office Access 2003 All-In-One Desk Reference For Dummies was written by three computer gurus: Alan Simpson, author of over 80 computer books; Margaret Levine Young, co-author of several dozen computer books, including The Internet for Dummies; and Alison Barrows, book author and writer and editor of technical documentation and training material. To give you hands-on experience and demonstrate practical applications of database management, there is a Web site that complements the book and features a fully functioning mail order management database used in examples throughout the book. You can download it and follow along as you explore: Working with external data sources such as Microsoft SQL Server Writing and debugging code Using HTML, JavaScript, Jscript, VB Script, and Java to facilitate the exchange of information on the Internet among different programs on disparate platforms Using data access pages (DAP) to share information on your intranet With Access 2003 All-In-One Desk Reference For Dummies, you’ll discover how to put information to work for you.",0764539884,9780764539886,rhN_QgAACAAJ,840,18.8x24.0x4.3 cm,,"Database management, Microsoft Access, Computers / Database Management / General, Computers / Desktop Applications / General",,http://bks4.books.google.com/books?id=rhN_QgAACAAJ&printsec=frontcover&img=1&zoom=1&source=gbs_gdata,http://books.google.com/books?id=rhN_QgAACAAJ
Accounting for non-accounting students,,,J. R. Dyson,,,Pitman,1994-01-01,,027360435X,9780273604358,9_hgQgAACAAJ,574,19.0x25.0x3.2 cm,,"Accountancy, Accounting, Business & Economics / Accounting / General",,,http://books.google.com/books?id=9_hgQgAACAAJ
Advanced PC architecture,,,"William Buchanan, Austin Wilson",,,Addison-Wesley,2001-01-01,"middot; The first book ever to give a complete picture of the workings of a PC! A comprehensive guide to the component systems of the PC, this book provides a foundation to the understanding of previous, current and future PC systems, and how the specification of each component of a PC affects the overall system performance.The book outlines each of the main PC processors and contrasts their performance. It also examines each of the main interface devices and shows how they integrate into the main systems.If you are an undergraduate or professional looking for a complete understanding of the internal architecture of the PC, and how it is changing, this book is for you. It explains how systems have evolved from the original PC, keeping its compatibility with previous systems, whilst increasing its power. It also provides an insight into how the PC will evolve in the future.Key chapters: middot; Motherboards - Analyses typical motherboards and shows how each of the components interfaces together, and how the architecture affects the system performance. middot; Memory - Shows how chache memory and DRAM memory interface to the system and the processor. middot; PCI bus - Discusses the fundamentals of the PCI bus and shows its importance in the architecture of modern PCs. middot; On-line multiple choice tests for students middot; On-line PowerPoint/HTML slides of all the graphics from the book. 0201398583B04062001",0201398583,9780201398588,SdtQAAAAMAAJ,596,18.7x24.0x1.2 cm,,"Computer architecture, Microcomputers, Computers / Systems Architecture / General, Computers / Hardware / Personal Computers / General, Computers / Computer Engineering, Computers / Computer Architecture",,http://bks9.books.google.com/books?id=SdtQAAAAMAAJ&printsec=frontcover&img=1&zoom=1&source=gbs_gdata,http://books.google.com/books?id=SdtQAAAAMAAJ
Advertising for dummies,,,Gary Dahl,,,John Wiley & Sons,2001-01-01,"For small businesses, effective advertising can mean the difference between fortune and failure. But if you’re going to throw your money into advertising willy-nilly you might as well just throw it away. And if your business can’t afford a big advertising firm you may have to write your own advertising copy. But could you? Don’t worry, because with Advertising For Dummies, you will! If you need help figuring out which advertising media offers you the most exposure or determining how much you can realistically spend on your advertising budget, then look no further. If you want shortcuts, insights, techniques, and money-saving facts that will get you the most bang for your advertising buck, then this is the book for you. It’s a guide to advertising for the rest of us — people for whom an advertising budget represents an important percentage of gross income and, therefore, must be spent very wisely. Inside you’ll find out how to li>Devise a realistic advertising budge Define and position your messag Create TV, radio, billboard, and Internet advertisin Use “ad-speak” effectivel This helpful guide covers every media, from Internet advertising to TV and radio to billboards or newspapers. You’ll master the fundamentals of advertising, learn to generate fresh ideas, and write great ads. You’ll write great press releases and discover the secret to saving money through co-op ads. And there’s more li>When and how to hire an ad agenc Why people choose one product over anothe Creating brochures and direct mail piece Designing an effective, inviting Web sit Sticking to a budge The difference between PR and publicit Ten secrets to writing memorable ad i>Advertising For Dummies presents the tips and tricks that advertising professionals use every day to get their message across. Now, you can use those same strategies and tactics to get the word out about your small business — and watch the money roll in",0764553771,9780764553776,htHNsrOhB-0C,342,18.8x23.4x1.9 cm,,"Advertising, Business & Economics / Advertising & Promotion",,http://bks0.books.google.com/books?id=htHNsrOhB-0C&printsec=frontcover&img=1&zoom=1&source=gbs_gdata,http://books.google.com/books?id=htHNsrOhB-0C
AI techniques for game programming,,,Mat Buckland,,,Cengage Learning,2002-01-01,"""AI Techniques for Game Programming"" takes the difficult topics of genetic algorithms and neural networks and explains them in plain English. Gone are the tortuous mathematic equations and abstract examples to be found in other books. Each chapter takes you through the theory a step at a time, explaining clearly how you can incorporate each technique into your own games. After a whirlwind tour of Windows programming, you will learn how to use genetic algorithms for optimization, path-finding, and evolving control sequences for your game agents. Coverage of neural network basics quickly advances to evolving neural motion controllers for your game agents and applying neural networks to obstacle avoidance and map exploration. Backpropagation and pattern recognition is also explained. By the time youre done, youll know how to train a network to recognize mouse gestures and how to use state-of-the-art techniques for creating neural networks with dynamic topologies.",193184108X,9781931841085,6F9nKQdj8hwC,477,18.8x24.0x2.5 cm,,"Artificial intelligence, Computer games/ Programming, Computer games, Computers, Electronic books, Genetic algorithms, Intelligent agents (Computer software), Neural networks (Computer science), Computers / Intelligence (AI) & Semantics, Computers / Programming / Games, Computers / Software Development & Engineering / General, Games / Video & Electronic, Computers / Artificial Intelligence",,http://bks1.books.google.com/books?id=6F9nKQdj8hwC&printsec=frontcover&img=1&zoom=1&source=gbs_gdata,http://books.google.com/books?id=6F9nKQdj8hwC
Amsterdam,,,"AA Staff, Teresa Fisher, Hilary Weston, Jackie Staddon",,,AA,2007-01-15,"Ideal for business and leisure, CityPack's are succinct with all the practical information you need. The guides have been completely revamped with new content design and layout. There are four main sections (using Paris as an example) Essential Paris, Paris by Area, Where to Stay and Need to Know. Each city has been broken up into colour-coded districts, with the colour-coding cross- referenced throughout each section. Essential Paris starts with the Top 25 sights plus a locator map, then essential information to get the most of a short break in the city. Paris by Area takes you through the city, district by district, with localised shopping and entertainment listings. Where to Stay picks the best hotels to suit your budget, with web addresses listed where available. Need to Know contains all the basics for a smooth-running trip. Each district within the city has a two-page, colour-coded locator map with sights listed.",0749550821,9780749550820,mCeAAgAACAAJ,128,11.1x19.9x20.0 cm,,"Amsterdam (Netherlands), Education / General, Travel / Europe / Benelux Countries (Belgium,, Netherlands,, Luxembourg)",,,http://books.google.com/books?id=mCeAAgAACAAJ
An introduction to object-oriented analysis,objects in plain English,,David Brown,,,Wiley,1997-01-01,"It's beyond buzz-word, beyond fad, beyond experimental...;Object-Oriented methods have taken over Information Systems Development! And now those methods are closing in on Business Process Reengineering! In simple English, this outstanding new text brings objects down to earth for everyone involved in system development. Real-world examples throughout show exactly how object-oriented analysis is done in today's business world. Plus, the author explores the larger picture, examining the global movement toward the use of objects, and the ramifications for analysts and programmers in systems development. An Introduction to Object-Oriented Analysis: Objects in Plain English presents: All the in-depth theory and skills readers need for the practical application of object-oriented methods Step-by-step explanations that progress naturally from the concrete to the abstract Real case studies that illuminate the concepts and methods, and simulate the way real-world systems analysts and users go about their business",0471110280,9780471110286,zAglAQAAIAAJ,744,24.0x24.0x3.3 cm,,"Object-oriented methods (Computer science), Computers / General, Computers / Programming / General, Computers / Programming / Object Oriented",,http://bks8.books.google.com/books?id=zAglAQAAIAAJ&printsec=frontcover&img=1&zoom=1&source=gbs_gdata,http://books.google.com/books?id=zAglAQAAIAAJ
ANSI/ISO C++ professional programmer's handbook,,,Danny Kalev,,,Que,1999-06-10,"The ANSI/ISO C++ Professional Programmers Handbook is a concise professional C++ reference tool that presents all of the changes and addenda to the language specification. It contains tips and guidelines for exerting the full potential of C++ as a multi-purpose object-oriented programming language. The new Standard Briefing component provides coverage of the latest version of the C++ language including additions and modifications to the language, new constructs such as built-in bool type, namespaces, RTTI, new header file conventions, internalization, memory management and new cast notation. Additionally, we've included a Manual of Programming Style, a Compatibility Compendium, and Future Directions",0789720221,9780789720221,7BViQgAACAAJ,356,18.7x24.0x23.5 cm,,"C&& (Computer program language), C++ (Computer program language), Computers / Programming / General, Computers / Programming Languages / C",,http://bks5.books.google.com/books?id=7BViQgAACAAJ&printsec=frontcover&img=1&zoom=1&source=gbs_gdata,http://books.google.com/books?id=7BViQgAACAAJ
AQA A2 Computing,,,"Sylvia Langfield, Kevin Bond",,,Nelson Thornes Limited,2009-06-30,,0748782982,9780748782987,AtpSPgAACAAJ,304,19.7x26.6x1.4 cm,,Computers / Computer Science,,,http://books.google.com/books?id=AtpSPgAACAAJ
Artificial intelligence,a modern approach,,"Stuart Jonathan Russell, Peter Norvig",,,Prentice Hall/Pearson Education,2003-01-01,"For one or two-semester, undergraduate or graduate-level courses in Artificial Intelligence.The long-anticipated revision of this best-selling text offers the most comprehensive, up-to-date introduction to the theory and practice of artificial intelligence.Click on ""Features"" tab below for more informationResources:Visit the author's website http://aima.cs.berkeley.edu/ to access both student and instructor resources including Power Point slides, syllabus. homework and exams, and solutions text problems.",0130803022,9780130803023,OyOrQgAACAAJ,1080,20.3x26.0x4.5 cm,,"Artificial intelligence, Computers / Intelligence (AI) & Semantics",,,http://books.google.com/books?id=OyOrQgAACAAJ
AutoCAD 2002 complete,,,Tiffany Taylor,,,Sybex,2002-01-01,"AutoCAD 2002 Complete is a one-of-a-kind book--valuable both for its broad content and its low price. This book will teach you everything you need to know about the latest release of the world's leading computer-aided design software. With AutoCAD 2002 Complete you'll quickly take advantage of all that AutoCAD 2002 has to offer. Learn basic commands, create drawings, add text and hatch patterns, and use blocks to work more efficiently. Generate 3D scenes and enhance your 3D modeling skills. Customize AutoCAD and create AutoLISP routines and VBA macros to automate tasks. AutoCAD 2002 Complete introduces you to the work of some of Sybex's finest authors, so you'll know where to go to learn even more about this powerful design and drafting program and related tools. Inside: Getting Started with AutoCAD 2002 * Starting Up AutoCAD 2002 * Understanding How Commands Work * Creating Your First Drawing Learning Basic Drafting * Basic Commands * Drawing Strategies * Putting Text into a Drawing * Creating Hatch Patterns * Using Dimensions * Grouping Objects into Blocks * Storing and Linking Data with Graphics 3D Modeling * Using Advanced 3D Features * Mastering 3D Solids * Integrating AutoCAD and 3D Studio VIZ Customization and Programming * Customization: Taking AutoCAD to the Limit * Integrating AutoCAD into Your Projects and Organization * Developing a Simple VBA Application * Creating VBA Macros * Exploring the IDE * VBA Programming Concepts * Understanding the AutoCAD Database * Accessing the Drawing Database * Data Types in a Drawing Database",0782129676,9780782129670,StseAQAAIAAJ,996,15.2x21.0x2.3 cm,,"AutoCAD, Computer graphics, Computer-aided design, Computers / CAD-CAM, Computers / Computer Graphics, Technology & Engineering / Drafting & Mechanical Drawing, Computers / Computer Graphics / General",,http://bks4.books.google.com/books?id=StseAQAAIAAJ&printsec=frontcover&img=1&zoom=1&source=gbs_gdata,http://books.google.com/books?id=StseAQAAIAAJ
Beginning ASP.NET Databases Using VB.NET,,,"John Kauffman, Fabio Claudio Ferracchiati, Brian Matsik, Jesudas Chinnathampi, Eric N. Mintz, Jan D. Narkiewicz, Kent Tegels, Donald Xie, John M. West, James Greenwood",,,John Wiley & Sons,2003-04-22,"What is this book about? For a web site to offer its users an experience that improves on that of newspapers or textbooks, it needs a way to change the information it contains dynamically - and that means it needs access to a data source. Through the combination of ASP.NET and ADO.NET, Microsoft provides everything necessary to access, read from, and write to a database, and then allow web users to view and manipulate that data from a web browser. In this book, we'll show you how it's done. What does this book cover? Packed with clear explanations and hands-on examples, Beginning ASP.NET Databases contains everything you'll need on your journey to becoming a confident, successful programmer of data-driven web sites. In particular, we'll look at li>Connecting to common data sources, including SQL Server and MS Acces Reading data with data reader and dataset object Creating and deleting records, and editing dat Displaying data with ASP.NET's web server control Writing and using stored procedures from VB.NET cod Placing your data access code in reusable class librarie The book closes with a real-world case study that consolidates the tutorials throughout the book into a practical result. Who is this book for? To use this book, you need a computer running either Windows 2000 or Windows XP Professional Edition. The examples it contains will not run on Windows XP Home Edition. This book is for people who have some experience of programming ASP.NET with Visual Basic .NET, are familiar with the operation of the .NET Framework, and want to learn how to use ASP.NET to make data-centric web applications. No prior knowledge of database programming is necessary",076454375X,9780764543753,YdlN2pobNPAC,480,18.6x22.9x2.7 cm,,"Active server pages, Microsoft .NET, Microsoft Visual BASIC, Computers / Database Management / General, Computers / Programming / General, Computers / Programming Languages / Visual BASIC, Computers / Web / Page Design, Computers / Data Modeling & Design, Computers / Internet / Web Page Design",,http://bks0.books.google.com/books?id=YdlN2pobNPAC&printsec=frontcover&img=1&zoom=1&source=gbs_gdata,http://books.google.com/books?id=YdlN2pobNPAC
"Beginning PHP5, Apache, and MySQL Web development",,,Elizabeth Naramore,,,Wiley Pub.,2005-01-01,"This update to a Wrox bestseller dives in and guides the reader through the entire process of creating dynamic, data-driven sites using the open source ""AMP"" model: Apache Web server, the MySQL database system, and the PHP scripting language. The team of expert authors covers PHP scripting, database management, security, integration, and e-commerce functions and comes complete with a useful syntax reference LI>Showcases three fully functional Web site examples, with implementations for both Windows and Linux, that readers can incorporate into their own projects LI>Updates include a new chapter on PHP5 features and functions, a new example Web site application, and updates to PHP5 throughout the text",0764579665,9780764579660,1DsALINvr9gC,818,19.6x24.0x4.6 cm,,"Apache (Computer file : Apache Group), Apache. Computer file, MySQL (Electronic resource), MySQL. Computer file, PHP (Computer program language), Web site development, Computers / Database Management / General, Computers / Programming Languages / General, Computers / Internet / General, Computers / Web / Site Design, Computers / Internet / Web Page Design",,http://bks0.books.google.com/books?id=1DsALINvr9gC&printsec=frontcover&img=1&zoom=1&source=gbs_gdata,http://books.google.com/books?id=1DsALINvr9gC
Beginning Visual C# 2005,,,"Karli Watson, Christian Nagel",,,Wiley Pub.,2006-01-01,"Creating next-generation software and applications is now easier than ever with the release of Visual C# 2005. This accessible book guides you through all aspects of C# programming and the capabilities of Visual Studio 2005 so that you can begin developing customized applications. You'll first learn all aspects of the C# language, from the fundamentals to object-oriented techniques. You'll then quickly progress through Windows(r) and Web programming to making use of data sources, and finally to some advanced techniques such as XML documentation and graphics programming with GDI+. Throughout the book, you'll also find helpful hints, tips, exercises, and full-fledged example code that will enhance your programming skills. This book covers everything you need to know about Visual C# 2005 and the .NET Framework to create powerful, secure applications for mobile devices, Web applications, Windows applications, and Web services. What you will learn from this book Ways to add functionality to your Visual C# applications How to publish applications to the Web with the click of a button Techniques for assembling advanced Windows applications with a minimum of effort and time Tips for using Web services to add complex data and functionality to Web applications How to improve your C# applications using object-oriented programming Steps for using ADO.NET to interact with databases and deal with XML Who this book is for This book is for anyone who wants to learn how to program in C# using the .NET Framework. It is also for programmers who know .NET 1.0 and want to find out about the latest features of .NET 2.0 and Visual Studio 2005. Wrox Beginning guides are crafted to make learning programming languages and technologies easier than you think, providing a structured, tutorial format that will guide you through all the techniques involved.",0764578472,9780764578472,TdPl5kzUOyQC,1104,18.8x24.0x5.2 cm,,"C (Computer program language), Microsoft .NET Framework, C# (Computer program language), Internet programming, Web site development, C♯ (Computer program language), Computers / Programming Languages / C#",,http://bks2.books.google.com/books?id=TdPl5kzUOyQC&printsec=frontcover&img=1&zoom=1&source=gbs_gdata,http://books.google.com/books?id=TdPl5kzUOyQC
Best Ever 3 & 4 Ingredient Ckbk,,,,,,Selectabook,,,1844777790,9781844777792,SvqfSQAACAAJ,,16.8x22.0x3.4 cm,,,,,http://books.google.com/books?id=SvqfSQAACAAJ
Britain in the 19th century,,,Howard Martin (historien)),,,N. Thornes,2002-01-01,,0174350627,9780174350620,9CUPSgAACAAJ,410,18.8x25.0x2.2 cm,,,,http://bks9.books.google.com/books?id=9CUPSgAACAAJ&printsec=frontcover&img=1&zoom=1&source=gbs_gdata,http://books.google.com/books?id=9CUPSgAACAAJ
